Kategori,Spørgsmål,Point,Rigtigt svar,Forkert svar 1,Forkert svar 2,Forkert svar 3,Rigtige hold,Hold 1 svar,Hold 2 svar,Kildetitel,Kilde-URL,Kildestatus,Kilde tjekket,Kildenote
Historie og idégrundlag,Hvilket år blev den første særlige efterskolelov vedtaget?,100,1930,1849,1901,1975,,,,Efterskolens historie og værdigrundlag,https://www.efterskolerne.dk/om-efterskoleforeningen/efterskolens-historie-og-vaerdigrundlag/,OK – valgt/verificeret i kildearbejdet,2026-07-09,"Underbygger efterskolens historiske udvikling fra Ryslinge/Kristen Kold, Grundtvig-inspiration, grænseskoler, prøveadgang, lovændringer, Tinglev/Ladelund, elevstøtte og selvevaluering."
Historie og idégrundlag,Hvilket år fik efterskoler lov til at tilbyde enkelte af folkeskolens afgangsprøver?,200,1967,1930,1975,1994,,,,Efterskolens historie og værdigrundlag,https://www.efterskolerne.dk/om-efterskoleforeningen/efterskolens-historie-og-vaerdigrundlag/,OK – valgt/verificeret i kildearbejdet,2026-07-09,"Underbygger efterskolens historiske udvikling fra Ryslinge/Kristen Kold, Grundtvig-inspiration, grænseskoler, prøveadgang, lovændringer, Tinglev/Ladelund, elevstøtte og selvevaluering."
Historie og idégrundlag,Hvilket år fik efterskoler lov til at tilbyde alle folkeskolens afgangsprøver?,300,1975,1967,1982,2000,,,,Efterskolens historie og værdigrundlag,https://www.efterskolerne.dk/om-efterskoleforeningen/efterskolens-historie-og-vaerdigrundlag/,OK – valgt/verificeret i kildearbejdet,2026-07-09,"Underbygger efterskolens historiske udvikling fra Ryslinge/Kristen Kold, Grundtvig-inspiration, grænseskoler, prøveadgang, lovændringer, Tinglev/Ladelund, elevstøtte og selvevaluering."
Historie og idégrundlag,Hvad skete der med både elevtal og antal efterskoler omtrent fra 1975 til 2000?,400,de blev omtrent fordoblet,de blev halveret hvert år,de forsvandt helt,de blev fastlåst ved lov,,,,Efterskolens historie og værdigrundlag,https://www.efterskolerne.dk/om-efterskoleforeningen/efterskolens-historie-og-vaerdigrundlag/,OK – valgt/verificeret i kildearbejdet,2026-07-09,"Underbygger efterskolens historiske udvikling fra Ryslinge/Kristen Kold, Grundtvig-inspiration, grænseskoler, prøveadgang, lovændringer, Tinglev/Ladelund, elevstøtte og selvevaluering."
Historie og idégrundlag,Hvilken ændring i 1994 gjorde efterskoleophold økonomisk tilgængeligt for en bredere gruppe?,500,obligatorisk offentlig elevstøtte,afskaffelse af kost og logi,forbud mod skolepenge,gratis togdrift til alle skoler,,,,Efterskolens historie og værdigrundlag,https://www.efterskolerne.dk/om-efterskoleforeningen/efterskolens-historie-og-vaerdigrundlag/,OK – valgt/verificeret i kildearbejdet,2026-07-09,"Underbygger efterskolens historiske udvikling fra Ryslinge/Kristen Kold, Grundtvig-inspiration, grænseskoler, prøveadgang, lovændringer, Tinglev/Ladelund, elevstøtte og selvevaluering."
Skoleform og rammer,Hvilke tre fag er obligatoriske i en almindelig 10. klasse på efterskole?,100,"dansk, matematik og engelsk","latin, græsk og kemi","musik, idræt og billedkunst","tysk, fransk og spansk",,,,Om 10. klasse,https://uvm.dk/grundskole/folkeskolen/fag-og-indhold/10-klasse/om-10-klasse/,OK – valgt/verificeret i kildearbejdet,2026-07-09,"Underbygger 10. klasses obligatoriske fag dansk, matematik og engelsk, OSO, timetal og obligatorisk brobygning."
Skoleform og rammer,"Hvad er minimum for den ugentlige undervisningstid på efterskolekurser i 8., 9. og 10. klasse ifølge de gældende rammer?",200,21 timer eksklusive pauser,5 timer inklusive pauser,40 timer uden pauser,10 timer om måneden,,,,Om 10. klasse,https://uvm.dk/grundskole/folkeskolen/fag-og-indhold/10-klasse/om-10-klasse/,OK – valgt/verificeret i kildearbejdet,2026-07-09,"Underbygger 10. klasses obligatoriske fag dansk, matematik og engelsk, OSO, timetal og obligatorisk brobygning."
Skoleform og rammer,Hvad kan en efterskole vælge i forhold til folkeskolens prøver i 8. og 9. klasse?,300,at afholde prøver eller være prøvefri efter reglerne,at opfinde nationale eksamensbeviser,at afskaffe karakterer i hele Danmark,at lade eleverne rette hinandens officielle prøver,,,,Privatister,https://uvm.dk/grundskole/folkeskolen/folkeskolens-proever/proevetilrettelaeggelse/elever-der-foelger-andre-undervisningstilbud/privatister/,OK – valgt/verificeret i kildearbejdet,2026-07-09,Underbygger at elever fra prøvefri skole eller andet undervisningstilbud kan aflægge folkeskolens prøver som privatister efter reglerne.
Skoleform og rammer,Hvad skal en prøvefri efterskole tydeligt oplyse om?,400,at skolen ikke afholder folkeskolens prøver,at skolen ikke har undervisning,at eleverne ikke må læse,at skolen er kommunal,,,,Privatister,https://uvm.dk/grundskole/folkeskolen/folkeskolens-proever/proevetilrettelaeggelse/elever-der-foelger-andre-undervisningstilbud/privatister/,OK – valgt/verificeret i kildearbejdet,2026-07-09,Underbygger at elever fra prøvefri skole eller andet undervisningstilbud kan aflægge folkeskolens prøver som privatister efter reglerne.
Skoleform og rammer,Hvordan kan en elev fra en prøvefri efterskole eventuelt aflægge folkeskolens prøver?,500,som privatist efter reglerne,kun som universitetsstuderende,ved at stemme om resultatet,uden tilmelding,,,,Privatister,https://uvm.dk/grundskole/folkeskolen/folkeskolens-proever/proevetilrettelaeggelse/elever-der-foelger-andre-undervisningstilbud/privatister/,OK – valgt/verificeret i kildearbejdet,2026-07-09,Underbygger at elever fra prøvefri skole eller andet undervisningstilbud kan aflægge folkeskolens prøver som privatister efter reglerne.
Hverdag og fællesskab,Hvad er hjemve?,100,savn og ubehag ved at være væk hjemmefra,en prøveform,et linjefag,en skolelov,,,,Har dit barn hjemve? Sådan støtter du bedst,https://www.efterskolerne.dk/om-efterskoleforeningen/nyheder/foraeldre/har-dit-barn-hjemve-saadan-stoetter-du-bedst/,OK – valgt/verificeret i kildearbejdet,2026-07-09,"Underbygger hjemve på efterskole og betydningen af klare rammer, kontaktlærer og støtte."
Hverdag og fællesskab,Hvad hjælper ofte ved almindelig hjemve?,200,at tale med en voksen og deltage gradvist i hverdagen,at isolere sig helt,at skjule problemet i måneder,at stoppe med at spise,,,,Har dit barn hjemve? Sådan støtter du bedst,https://www.efterskolerne.dk/om-efterskoleforeningen/nyheder/foraeldre/har-dit-barn-hjemve-saadan-stoetter-du-bedst/,OK – valgt/verificeret i kildearbejdet,2026-07-09,"Underbygger hjemve på efterskole og betydningen af klare rammer, kontaktlærer og støtte."
Hverdag og fællesskab,Hvorfor har mange efterskoler regler om ro og sengetid?,300,for at sikre søvn og hensyn i et tæt fællesskab,for at afskaffe fritid,for at gøre undervisningen kortere,for at forhindre venskaber,,,,Sundhedsstyrelsens anbefalinger om brug af skærm.,https://www.sst.dk/media/fhqlhhg2/skaerm_sst_anbefalinger.pdf,OK – valgt/verificeret i kildearbejdet,2026-07-09,"Underbygger sammenhængen mellem skærmbrug op til sovetid, søvn, nærvær og behovet for rammer for mobil/skærm."
Hverdag og fællesskab,Hvad er en vigtig grund til faste rengøringsopgaver?,400,fælles hygiejne og delt ansvar,at eleverne skal drive et rengøringsfirma,at lærere ikke må gøre rent,at erstatte alle fag,,,,Hvad er en efterskole?,https://www.efterskolerne.dk/for-elever-og-foraeldre/hvad-er-en-efterskole/,OK – valgt/verificeret i kildearbejdet,2026-07-09,"Underbygger efterskolelivets fokus på fællesskab, ansvar, at passe på hinanden, praktiske opgaver, køkkenhjælp, egne interesser, linje-/profilfag og valgfag."
Hverdag og fællesskab,Hvordan bør personlige grænser på et delt værelse håndteres?,500,med tydelige aftaler og respekt,ved at tage hinandens ting frit,ved at ignorere privatliv,ved at stemme om personlig post,,,,Efterskoler i Sønderjylland,https://graenseforeningen.dk/leksikon/efterskoler-i-soenderjylland,OK – valgt/verificeret i kildearbejdet,2026-07-09,"Underbygger grænseskoler, efterskoleophold for sydslesvigske/dansksindede unge og oprettelsen af Ladelund i 1982."
"Fag, prøver og elevdemokrati",Hvad er FP9?,100,folkeskolens prøver efter 9. klasse,forstanderens pensionsordning,et niugers valgfag,en type elevværelse,,,,"Prøvefag i 8., 9. og 10. klasse",https://uvm.dk/grundskole/folkeskolen/folkeskolens-proever/proevetilrettelaeggelse/adgang-tilmelding-og-booking/proevefag-i-8-9-og-10-klasse/,OK – valgt/verificeret i kildearbejdet,2026-07-09,"Underbygger folkeskolens prøver på 8., 9. og 10. klassetrin og rammer for prøvefag."
"Fag, prøver og elevdemokrati",Hvad er formålet med en mundtlig prøve?,200,at eleven viser faglig forståelse gennem fremlæggelse og samtale,at måle løbehastighed,at vælge værelseskammerat,at bestemme skolens værdier,,,,"Prøvefag i 8., 9. og 10. klasse",https://uvm.dk/grundskole/folkeskolen/folkeskolens-proever/proevetilrettelaeggelse/adgang-tilmelding-og-booking/proevefag-i-8-9-og-10-klasse/,OK – valgt/verificeret i kildearbejdet,2026-07-09,"Underbygger folkeskolens prøver på 8., 9. og 10. klassetrin og rammer for prøvefag."
"Fag, prøver og elevdemokrati",Hvad er intern evaluering?,300,løbende vurdering og feedback inden for skolen,en national folkeafstemning,økonomisk revision alene,et valg til Folketinget,,,,Hvad er formativ evaluering?,https://emu.dk/test-og-evalueringsbank/om-formativ-evalueringskultur/hvad-er-formativ-evaluering,OK – valgt/verificeret i kildearbejdet,2026-07-09,"Underbygger formativ evaluering/feedback som noget, der hjælper eleven videre i læreprocessen."
"Fag, prøver og elevdemokrati",Hvad er formativ feedback?,400,"feedback, der hjælper eleven videre i læreprocessen",en afsluttende karakter uden kommentar,en regel om sengetid,en besked om skolepenge,,,,Hvad er formativ evaluering?,https://emu.dk/test-og-evalueringsbank/om-formativ-evalueringskultur/hvad-er-formativ-evaluering,OK – valgt/verificeret i kildearbejdet,2026-07-09,"Underbygger formativ evaluering/feedback som noget, der hjælper eleven videre i læreprocessen."
"Fag, prøver og elevdemokrati",Hvad er summativ evaluering?,500,en afsluttende vurdering af et fagligt resultat,en uformel morgensamtale,en rengøringsopgave,et værelsesmøde,,,,Evaluering (summativ og formativ) - Formål og niveauer - Lex,https://lex.dk/evaluering_-_summativ_og_formativ,OK – valgt/verificeret i kildearbejdet,2026-07-09,Underbygger forskellen mellem formativ og summativ evaluering og feedbackens rolle i læring.
