Kategori,Spørgsmål,Point,Rigtigt svar,Forkert svar 1,Forkert svar 2,Forkert svar 3,Rigtige hold,Hold 1 svar,Hold 2 svar,Kildetitel,Kilde-URL,Kildestatus,Kilde tjekket,Kildenote
Ord og udtryk,Hvad betyder det spanske ord eller udtryk ‘queso’?,100,ost,æble,brød,mælk,,,,Wiktionary – queso,https://en.wiktionary.org/wiki/queso,OK,2026-07-09,Åben ordbogsartikel. Underbygger betydningen af det spanske ord eller udtryk.
Ord og udtryk,Hvad betyder det spanske ord eller udtryk ‘pan’?,200,brød,æble,ost,mælk,,,,Wiktionary – pan,https://en.wiktionary.org/wiki/pan,OK,2026-07-09,Åben ordbogsartikel. Underbygger betydningen af det spanske ord eller udtryk.
Ord og udtryk,Hvad betyder det spanske ord eller udtryk ‘leche’?,300,mælk,æble,ost,brød,,,,Wiktionary – leche,https://en.wiktionary.org/wiki/leche,OK,2026-07-09,Åben ordbogsartikel. Underbygger betydningen af det spanske ord eller udtryk.
Ord og udtryk,Hvad betyder det spanske ord eller udtryk ‘lunes’?,400,mandag,vi ses i morgen,i går,snart,,,,Wiktionary – lunes,https://en.wiktionary.org/wiki/lunes,OK,2026-07-09,Åben ordbogsartikel. Underbygger betydningen af det spanske ord eller udtryk.
Ord og udtryk,Hvad betyder det spanske ord eller udtryk ‘hasta mañana’?,500,vi ses i morgen,mandag,i går,snart,,,,Wiktionary – hasta mañana,https://en.wiktionary.org/wiki/hasta_ma%C3%B1ana,OK,2026-07-09,Åben ordbogs-/phrasebookartikel. Underbygger betydningen “vi ses i morgen/indtil i morgen”.
Grammatik og udtale,Hvilket ord betyder “der er” i nutid?,100,hay,es,está,tiene,,,,Wiktionary – hay,https://en.wiktionary.org/wiki/hay,OK,2026-07-09,Åben ordbogsartikel. Underbygger hay som udtryk for “der er/der findes”.
Grammatik og udtale,Hvilken form af “tener” passer til “yo”?,200,tengo,tiene,tenemos,tienes,,,,Wiktionary – tener,https://en.wiktionary.org/wiki/tener,OK,2026-07-09,Åben bøjnings-/ordbogsartikel. Underbygger formen tengo af tener.
Grammatik og udtale,Hvilken form af “ir” passer til “nosotros”?,300,vamos,van,vais,voy,,,,Wiktionary – ir,https://en.wiktionary.org/wiki/ir,OK,2026-07-09,Åben bøjnings-/ordbogsartikel. Underbygger formerne vamos og fui af ir.
Grammatik og udtale,Hvad er præteritumsformen af “ir” med “yo”?,400,fui,iba,voy,iré,,,,Wiktionary – ir,https://en.wiktionary.org/wiki/ir,OK,2026-07-09,Åben bøjnings-/ordbogsartikel. Underbygger formerne vamos og fui af ir.
Grammatik og udtale,Hvilken form er imperfektum af “ser” med “yo”?,500,era,fui,soy,sería,,,,Wiktionary – ser,https://en.wiktionary.org/wiki/ser,OK,2026-07-09,Åben bøjnings-/ordbogsartikel. Underbygger formen era af ser.
Kunst og kultur,Hvem skrev værket “La ciudad y los perros”?,100,Mario Vargas Llosa,Isabel Allende,Pablo Neruda,Octavio Paz,,,,Wikipedia – The Time of the Hero,https://en.wikipedia.org/wiki/The_Time_of_the_Hero,OK,2026-07-09,Åben artikel om romanen La ciudad y los perros/The Time of the Hero. Underbygger Mario Vargas Llosa som forfatter.
Kunst og kultur,Hvem skabte værket eller figuren La Celestina?,200,Fernando de Rojas,Quino,Juan Ramón Jiménez,Pedro Calderón de la Barca,,,,Wikipedia – La Celestina,https://en.wikipedia.org/wiki/La_Celestina,OK,2026-07-09,Åben artikel om La Celestina. Underbygger Fernando de Rojas.
Kunst og kultur,Hvem skabte værket eller figuren Mafalda?,300,Quino,Fernando de Rojas,Juan Ramón Jiménez,Pedro Calderón de la Barca,,,,Wikipedia – Mafalda,https://en.wikipedia.org/wiki/Mafalda,OK,2026-07-09,Åben artikel om tegneseriefiguren. Underbygger Quino som skaber.
Kunst og kultur,Hvem skabte værket eller figuren Platero y yo?,400,Juan Ramón Jiménez,Fernando de Rojas,Quino,Pedro Calderón de la Barca,,,,Wikipedia – Platero and I,https://en.wikipedia.org/wiki/Platero_and_I,OK,2026-07-09,Åben artikel om værket. Underbygger Juan Ramón Jiménez som forfatter.
Kunst og kultur,Hvem skabte værket eller figuren La vida es sueño?,500,Pedro Calderón de la Barca,Fernando de Rojas,Quino,Juan Ramón Jiménez,,,,Wikipedia – Life Is a Dream,https://en.wikipedia.org/wiki/Life_Is_a_Dream,OK,2026-07-09,Åben artikel om værket. Underbygger Pedro Calderón de la Barca som forfatter.
Den spansktalende verden,"Hvilket land passer til beskrivelsen “spansk, fransk og portugisisk er officielle sprog”?",100,Ækvatorialguinea,Paraguay,Bolivia,Peru,,,,Wikipedia – Equatorial Guinea,https://en.wikipedia.org/wiki/Equatorial_Guinea,OK,2026-07-09,"Åben landeartikel. Underbygger officielle sprog, herunder spansk, fransk og portugisisk."
Den spansktalende verden,Hvilket land passer til beskrivelsen “spansk samt quechua og aymara har officiel status i relevante områder”?,200,Peru,Paraguay,Bolivia,Ækvatorialguinea,,,,Wikipedia – Languages of Peru,https://en.wikipedia.org/wiki/Languages_of_Peru,OK,2026-07-09,Åben artikel om sprog i Peru. Underbygger spansk samt quechua og aymara i relevante områder.
Den spansktalende verden,I hvilket land eller område ligger Machu Picchu?,300,Peru,Chile,Mexico,Colombia,,,,UNESCO World Heritage Centre – Historic Sanctuary of Machu Picchu,https://whc.unesco.org/en/list/274/,OK,2026-07-09,Officiel UNESCO-side. Underbygger Machu Picchu i Peru.
Den spansktalende verden,"I hvilket land eller område ligger Rapa Nui, også kaldet Påskeøen?",400,Chile,Peru,Mexico,Colombia,,,,UNESCO World Heritage Centre – Rapa Nui National Park,https://whc.unesco.org/en/list/715/,OK,2026-07-09,Officiel UNESCO-side. Underbygger Rapa Nui/Påskeøen som chilensk verdensarv.
Den spansktalende verden,I hvilket land eller område ligger Chichén Itzá?,500,Mexico,Peru,Chile,Colombia,,,,UNESCO World Heritage Centre – Pre-Hispanic City of Chichen-Itza,https://whc.unesco.org/en/list/483/,OK,2026-07-09,Officiel UNESCO-side. Underbygger Chichén Itzá i Mexico.
