Kategori,Spørgsmål,Point,Rigtigt svar,Forkert svar 1,Forkert svar 2,Forkert svar 3,Rigtige hold,Hold 1 svar,Hold 2 svar,Kildetitel,Kilde-URL,Kildestatus,Kilde tjekket,Kildenote
Forfattere og værker,Hvem skrev eventyret “Den grimme ælling”?,100,H.C. Andersen,Ludvig Holberg,Karen Blixen,Tove Ditlevsen,,,,H.C. Andersens eventyr,https://andersen.sdu.dk/vaerk/register/eventyr.html,OK – åbnet/verificeret,2026-07-09,"Underbygger H.C. Andersens eventyr, bl.a. Den grimme Ælling og Klods-Hans."
Forfattere og værker,Hvem skrev romanen “Pelle Erobreren”?,200,Martin Andersen Nexø,Henrik Pontoppidan,Johannes V. Jensen,Herman Bang,,,,Pelle Erobreren - Lex,https://lex.dk/Pelle_Erobreren,OK – åbnet/verificeret,2026-07-09,Underbygger Martin Andersen Nexø som forfatter til Pelle Erobreren og Lasse Karlsson som Pelles far.
Perioder og strømninger,"Hvad kaldes de anonyme fortællende sange, som blev overleveret mundtligt fra middelalderen?",100,folkeviser,salmer,kronikker,epigrammer,,,,folkevise - Lex,https://lex.dk/folkevise,OK – åbnet/verificeret,2026-07-09,Underbygger folkeviser som anonyme fortællende sange overleveret mundtligt.
"Figurer, former og genrer","Hvad hedder drengen, der rider på en ged i et eventyr af H.C. Andersen?",100,Klods-Hans,Fyrtøjet,Ole Lukøje,Lille Claus,,,,Klods-Hans - H.C. Andersen,https://www.andersenstories.com/da/andersen_fortaellinger/klods_hans,OK – åbnet/verificeret,2026-07-09,Underbygger Klods-Hans og ged/prinsesse-motivet i eventyret.
"Priser, sprog og litteraturliv",Hvilke to danske forfattere delte Nobelprisen i litteratur i 1917?,100,Henrik Pontoppidan og Karl Gjellerup,Johannes V. Jensen og Martin Andersen Nexø,Karen Blixen og Tove Ditlevsen,Herman Bang og J.P. Jacobsen,,,,The Nobel Prize in Literature 1917,https://www.nobelprize.org/prizes/literature/1917/summary/,OK – åbnet/verificeret,2026-07-09,Underbygger Nobelprisen i litteratur 1917 til Henrik Pontoppidan og Karl Gjellerup.
