Kategori,Spørgsmål,Point,Rigtigt svar,Forkert svar 1,Forkert svar 2,Forkert svar 3,Rigtige hold,Hold 1 svar,Hold 2 svar,Kildetitel,Kilde-URL,Kildestatus,Kilde tjekket,Kildenote
Grundlov og Folketing,Hvad hedder Danmarks nationale parlament?,100,Folketinget,Landstinget,Statsrådet,Rigsretten,,,,Folketinget,https://www.ft.dk/da/leksikon/Folketinget,OK – valgt/verificeret i kildearbejdet,2026-07-09,"Underbygger Folketinget som Danmarks parlament, 179 medlemmer, 175 valgt i Danmark og 2 fra henholdsvis Grønland og Færøerne samt Folketingets adresse på Christiansborg."
Grundlov og Folketing,Hvor holder Folketinget til?,200,Christiansborg,Amalienborg,Rosenborg,Børsen,,,,Folketinget,https://www.ft.dk/da/leksikon/Folketinget,OK – valgt/verificeret i kildearbejdet,2026-07-09,"Underbygger Folketinget som Danmarks parlament, 179 medlemmer, 175 valgt i Danmark og 2 fra henholdsvis Grønland og Færøerne samt Folketingets adresse på Christiansborg."
Valg og partier,Hvilken valgmetode bruges overordnet ved folketingsvalg for at fordele mandater efter stemmetal?,100,forholdstalsvalg,flertalsvalg i enkeltmandskredse,lodtrækning,indirekte valg,,,,Det danske valgsystem: Valg til Folketinget,https://www.valg.im.dk/valg/valgsystemet/opgoerelse-af-folketingsvalg,OK – valgt/verificeret i kildearbejdet,2026-07-09,"Underbygger forholdstalsvalg, mandatfordeling, spærregrænse, kredsmandater og tillægsmandater ved folketingsvalg."
Regeringer og politisk historie,Hvem blev regeringsleder efter systemskiftet i 1901?,100,J.H. Deuntzer,J.B.S. Estrup,Thorvald Stauning,Carl Theodor Zahle,,,,statsministre i Danmark - Oversigt fra 1848 til nu - Lex,https://lex.dk/statsministre_i_Danmark,OK – valgt/verificeret i kildearbejdet,2026-07-09,Underbygger perioder og navne i listen over danske statsministre.
"Kommuner, regioner og rigsfællesskab","Hvor mange kommuner blev der oprettet ved strukturreformen, som trådte i kraft i 2007?",100,98,70,130,275,,,,Strukturreformen - Inddeling af Danmark - Læs mere – Lex,https://lex.dk/Strukturreformen,OK – valgt/verificeret i kildearbejdet,2026-07-09,"Underbygger strukturreformen, 98 kommuner og fem regioner fra 2007."
