Kategori,Spørgsmål,Point,Rigtigt svar,Forkert svar 1,Forkert svar 2,Forkert svar 3,Rigtige hold,Hold 1 svar,Hold 2 svar,Kildetitel,Kilde-URL,Kildestatus,Kilde tjekket,Kildenote
Instruktører og film,Hvem instruerede science fiction-filmen “E.T. the Extra-Terrestrial” fra 1982?,100,Steven Spielberg,George Lucas,Robert Zemeckis,James Cameron,,,,Wikipedia – E.T. the Extra-Terrestrial,https://en.wikipedia.org/wiki/E.T._the_Extra-Terrestrial,OK,2026-07-09,"Åben filmartikel. Underbygger instruktør, rollebesætning og filmmusik for E.T. the Extra-Terrestrial."
Instruktører og film,Hvem instruerede “The Shining” fra 1980?,200,Stanley Kubrick,David Lynch,John Carpenter,Brian De Palma,,,,Wikipedia – The Shining (film),https://en.wikipedia.org/wiki/The_Shining_(film),OK,2026-07-09,Åben filmartikel. Underbygger instruktør og hovedrolle for The Shining.
Roller og skuespillere,Hvem spiller arkæologen Indiana Jones i “Raiders of the Lost Ark”?,100,Harrison Ford,Kurt Russell,Michael Douglas,Tom Selleck,,,,Wikipedia – Raiders of the Lost Ark,https://en.wikipedia.org/wiki/Raiders_of_the_Lost_Ark,OK,2026-07-09,Åben filmartikel. Underbygger instruktør og rollebesætning for Raiders of the Lost Ark.
Oscarvindere,Hvilken film fra 1980 vandt Oscar for bedste film ved uddelingen i 1981?,100,Ordinary People,Raging Bull,The Elephant Man,Coal Miner’s Daughter,,,,Academy of Motion Picture Arts and Sciences – The 53rd Academy Awards | 1981,https://www.oscars.org/oscars/ceremonies/1981,OK,2026-07-09,"Officiel Oscars-side. Underbygger kategori, vinder og film/person for det pågældende år."
"Musik, teknik og filmhistorie",Hvem komponerede filmmusikken til “E.T. the Extra-Terrestrial”?,100,John Williams,Jerry Goldsmith,James Horner,Alan Silvestri,,,,Wikipedia – E.T. the Extra-Terrestrial,https://en.wikipedia.org/wiki/E.T._the_Extra-Terrestrial,OK,2026-07-09,"Åben filmartikel. Underbygger instruktør, rollebesætning og filmmusik for E.T. the Extra-Terrestrial."
