Kategori,Spørgsmål,Point,Rigtigt svar,Forkert svar 1,Forkert svar 2,Forkert svar 3,Rigtige hold,Hold 1 svar,Hold 2 svar,Kildetitel,Kilde-URL,Kildestatus,Kilde tjekket,Kildenote
Klima og drivhuseffekt,Hvad beskriver klima i modsætning til det daglige vejr?,100,vejrmønstre og gennemsnit over længere tid,vejret på én bestemt time,kun vindretningen på en bestemt dag,en enkelt ekstrem hændelse,,,,IPCC SR1.5 – Glossary,https://www.ipcc.ch/sr15/chapter/glossary/,OK,2026-07-09,"IPCC-ordliste. Underbygger centrale klimabegreber som mitigation, adaptation, net zero, carbon budget, carbon sink/source, resilience, climate model og tipping point."
Klima og drivhuseffekt,Hvad er den naturlige drivhuseffekt?,200,at atmosfæriske gasser tilbageholder en del af Jordens varmestråling,at skyer altid sender alt sollys tilbage,at havet stopper Jordens rotation,at planter producerer varme om natten,,,,DMI – Drivhuseffekten,https://www.dmi.dk/klima/temaforside-energiens-rejse-i-klimasystemet/drivhuseffekten,OK,2026-07-09,"Dansk DMI-side. Underbygger den naturlige drivhuseffekt, Jordens energistrømme og refleksion/absorption ved overfladen."
Menneskelige udledninger,"Hvilken drivhusgas frigives især ved afbrænding af kul, olie og naturgas?",100,kuldioxid,argon,ilt,neon,,,,DMI – Kuldioxid (CO₂),https://www.dmi.dk/klima/temaforside-drivhusgasser/kuldioxid-co2,OK,2026-07-09,"Dansk DMI-side. Underbygger CO₂ fra forbrænding af fossile brændsler og biomasse, nedbrydning af organisk stof samt CO₂s lange klimaeffekt."
Følger og risici,"Hvorfor stiger havniveauet, når havet bliver varmere?",100,havvandet udvider sig ved opvarmning,varmt vand bliver tungere og synker,havbunden forsvinder,salt omdannes til gas,,,,NASA Science – The Ocean and Climate Change,https://science.nasa.gov/earth/explore/the-ocean-and-climate-change/,OK,2026-07-09,"NASA-side. Underbygger havets varmeoptag, termisk udvidelse, smeltning af landis og havniveaustigning."
Løsninger og aftaler,"Hvad betyder modvirkning, også kaldet mitigation, i klimapolitik?",100,at reducere udledninger eller øge optag af drivhusgasser,at forudsige morgendagens vejr,at flytte alle kystbyer,at måle jordskælv,,,,IPCC SR1.5 – Glossary,https://www.ipcc.ch/sr15/chapter/glossary/,OK,2026-07-09,"IPCC-ordliste. Underbygger centrale klimabegreber som mitigation, adaptation, net zero, carbon budget, carbon sink/source, resilience, climate model og tipping point."
