Kategori,Spørgsmål,Point,Rigtigt svar,Forkert svar 1,Forkert svar 2,Forkert svar 3,Rigtige hold,Hold 1 svar,Hold 2 svar,Kildetitel,Kilde-URL,Kildestatus,Kilde tjekket,Kildenote
Guder og slægter,Hvilken nordisk gud svinger hammeren Mjølner?,100,Thor,Odin,Frej,Tyr,,,,Lex – Thor,https://lex.dk/Thor,OK,2026-07-09,Lex beskriver Thor som central nordisk gud og knytter ham til hammeren Mjølner.
Guder og slægter,Hvilken gud er far til Balder i de eddiske fortællinger?,200,Odin,Thor,Njord,Heimdal,,,,Mytologi Lex – Odin,https://mytologi.lex.dk/Odin,OK,2026-07-09,Mytologi Lex beskriver Odin og hans centrale rolle i nordisk mytologi.
Væsner og genstande,Hvad hedder Odins ottebenede hest?,100,Sleipner,Gulltop,Skinfaxe,Hrimfaxe,,,,Wikipedia – Sleipnir,https://en.wikipedia.org/wiki/Sleipnir,OK,2026-07-09,Åben artikel om Odins ottebenede hest Sleipnir/Sleipner.
Verdener og fortællinger,Hvad hedder menneskenes verden i nordisk mytologi?,100,Midgård,Asgård,Jotunheim,Vanaheim,,,,Wikipedia – Midgard,https://en.wikipedia.org/wiki/Midgard,OK,2026-07-09,Åben artikel om Midgård/Midgard som menneskenes verden.
"Kilder, ritualer og ord","Hvad kaldes samlingen af oldnordiske gudedigte og heltedigte, som blandt andet rummer Vølvens Spådom?",100,Den Poetiske Edda,Heimskringla,Gesta Danorum,Landnámabók,,,,Wikipedia – Poetic Edda,https://en.wikipedia.org/wiki/Poetic_Edda,OK,2026-07-09,Åben artikel om Den Poetiske Edda/Den Ældre Edda som samling af oldnordiske gudedigte og heltedigte.
