Kategori,Spørgsmål,Point,Rigtigt svar,Forkert svar 1,Forkert svar 2,Forkert svar 3,Rigtige hold,Hold 1 svar,Hold 2 svar,Kildetitel,Kilde-URL,Kildestatus,Kilde tjekket,Kildenote
Første Verdenskrig,I hvilken by blev ærkehertug Franz Ferdinand myrdet i juni 1914?,100,Sarajevo,Beograd,Wien,Prag,,,,Wikipedia – Assassination of Archduke Franz Ferdinand,https://en.wikipedia.org/wiki/Assassination_of_Archduke_Franz_Ferdinand,OK,2026-07-09,Åben artikel om mordet på Franz Ferdinand i Sarajevo i juni 1914.
Første Verdenskrig,Hvilket land erklærede krig mod Serbien den 28. juli 1914?,200,Østrig-Ungarn,Frankrig,Storbritannien,Italien,,,,Wikipedia – July Crisis,https://en.wikipedia.org/wiki/July_Crisis,OK,2026-07-09,Åben artikel om julikrisen og Østrig-Ungarns krigserklæring mod Serbien 28. juli 1914.
Anden Verdenskrig i Europa,Hvilket land invaderede Tyskland den 1. september 1939?,100,Polen,Belgien,Frankrig,Danmark,,,,Wikipedia – Invasion of Poland,https://en.wikipedia.org/wiki/Invasion_of_Poland,OK,2026-07-09,Åben artikel om Tysklands invasion af Polen 1. september 1939.
Global krig og Holocaust,Hvilken amerikansk flådebase blev angrebet af Japan den 7. december 1941?,100,Pearl Harbor,Midway,Guadalcanal,Manila Bay,,,,Wikipedia – Attack on Pearl Harbor,https://en.wikipedia.org/wiki/Attack_on_Pearl_Harbor,OK,2026-07-09,Åben artikel om Japans angreb på Pearl Harbor 7. december 1941.
"Danmark, Norden og efterspil",På hvilken dato blev Danmark besat af Tyskland?,100,9. april 1940,29. august 1943,5. maj 1945,1. september 1939,,,,Danmarkshistorien/Lex – Besættelsen den 9. april 1940,https://danmarkshistorien.lex.dk/Bes%C3%A6ttelsen_den_9._april_1940,OK,2026-07-09,Dansk fagkilde om Tysklands besættelse af Danmark den 9. april 1940.
